{
  "documentVersion": 1,
  "namespace": "matrixsmith",
  "id": "iledhat-31ae-32x16",
  "revision": "1",
  "implementation": "coolledux-reviewed-v1",
  "label": "iLedHat 31AE 32\u00d716",
  "matching": {
    "name": "iledhat",
    "serviceUuid": "0000fff0-0000-1000-8000-00805f9b34fb",
    "characteristicUuid": "0000fff1-0000-1000-8000-00805f9b34fb",
    "requiredProperties": ["read", "notify", "writeWithoutResponse"]
  },
  "contradictions": {
    "companyId": 12718,
    "geometry": true
  },
  "dimensions": {
    "width": 32,
    "height": 16
  },
  "parameters": {
    "brightness": {
      "min": 0,
      "max": 255
    }
  },
  "templates": ["coolledux-source-v1"],
  "limitations": [
    "Historical characterization applies only to the reviewed built-in definition. Loading local data establishes no physical claims.",
    "Tile width, row stride, channel mapping and command semantics remain reviewed application code."
  ],
  "sources": ["research/protocol-findings.md", "research/coolledux-sources.md"]
}
